Code,Title,Description
identification,Identification,Identification refers to the decision to develop a project within the budget and programme of a project owner (the public entity responsible for executing the budget).
preparation,Preparation,"Preparation covers the feasibility study, environmental and social impact assessment, general scoping of the project, establishing the packaging and procurement strategy, preliminary statutory requirements on environmental and land impacts, and the resulting budget authorization."
implementation,implementation,"Implementation covers the procurement and implementation of the group of works or services (such as design and supervision) to be delivered under the project, including works or services performed by the procuring entity. This differs from the definition of 'implementation' in OCDS, which covers the implementation but not the procurement."
completion,Completion,"Completion covers the handover of the assets and close-out activities with details of the final scope, cost, and delivery time."
completed,Completed,"Close-out activities were completed, and this project is inactive."
cancelled,Cancelled,"This project was cancelled before close-out activities were completed, and is inactive. Cancellation can occur anytime after identification."
